"","ID","Description","GeneRatio","BgRatio","pvalue","p.adjust","qvalue","geneID","Count"
"GO:0034975","GO:0034975","protein folding in endoplasmic reticulum","4/4","11/18800",6.34208995607401e-14,1.19865500169799e-11,3.07090671557268e-12,"CALR/HSP90B1/P4HB/PDIA3",4
"GO:0006457","GO:0006457","protein folding","4/4","212/18800",1.5721396221962e-08,1.48567194297541e-06,3.80623276952765e-07,"CALR/HSP90B1/P4HB/PDIA3",4
"GO:0034976","GO:0034976","response to endoplasmic reticulum stress","4/4","257/18800",3.41235496659114e-08,2.14978362895242e-06,5.50766064783131e-07,"CALR/HSP90B1/P4HB/PDIA3",4
"GO:0098760","GO:0098760","response to interleukin-7","2/4","14/18800",3.08716835149994e-06,0.000116694963686698,2.98967882461046e-05,"P4HB/PDIA3",2
"GO:0098761","GO:0098761","cellular response to interleukin-7","2/4","14/18800",3.08716835149994e-06,0.000116694963686698,2.98967882461046e-05,"P4HB/PDIA3",2
"GO:0002396","GO:0002396","MHC protein complex assembly","2/4","20/18800",6.44299221233595e-06,0.000173960789733071,4.4568066431196e-05,"CALR/PDIA3",2
"GO:0002501","GO:0002501","peptide antigen assembly with MHC protein complex","2/4","20/18800",6.44299221233595e-06,0.000173960789733071,4.4568066431196e-05,"CALR/PDIA3",2
"GO:0002474","GO:0002474","antigen processing and presentation of peptide antigen via MHC class I","2/4","29/18800",1.3758864735222e-05,0.000325053179369619,8.32773391868699e-05,"CALR/PDIA3",2
"GO:1900026","GO:1900026","positive regulation of substrate adhesion-dependent cell spreading","2/4","42/18800",2.91513611825683e-05,0.000612178584833934,0.000156837732678145,"CALR/P4HB",2
"GO:1900024","GO:1900024","regulation of substrate adhesion-dependent cell spreading","2/4","58/18800",5.59029758074612e-05,0.00105656624276102,0.000270688093383496,"CALR/P4HB",2
"GO:0048002","GO:0048002","antigen processing and presentation of peptide antigen","2/4","63/18800",6.60252435391822e-05,0.00113443372990049,0.000290637435674869,"CALR/PDIA3",2
"GO:0010770","GO:0010770","positive regulation of cell morphogenesis involved in differentiation","2/4","79/18800",0.000104041242709354,0.00163864957267232,0.000419815540757042,"CALR/P4HB",2
"GO:0030433","GO:0030433","ubiquitin-dependent ERAD pathway","2/4","86/18800",0.000123363033376955,0.00179350871601881,0.000459489840918213,"CALR/HSP90B1",2
"GO:0010769","GO:0010769","regulation of cell morphogenesis involved in differentiation","2/4","96/18800",0.000153799030988466,0.00207628691834429,0.000531936498155595,"CALR/P4HB",2
"GO:0019882","GO:0019882","antigen processing and presentation","2/4","107/18800",0.000191121040356544,0.00220505883149388,0.000564927353097848,"CALR/PDIA3",2
"GO:0034446","GO:0034446","substrate adhesion-dependent cell spreading","2/4","109/18800",0.000198338625055005,0.00220505883149388,0.000564927353097848,"CALR/P4HB",2
"GO:0036503","GO:0036503","ERAD pathway","2/4","109/18800",0.000198338625055005,0.00220505883149388,0.000564927353097848,"CALR/HSP90B1",2
"GO:0010811","GO:0010811","positive regulation of cell-substrate adhesion","2/4","122/18800",0.000248485108711314,0.0026090936414688,0.000668439473726342,"CALR/P4HB",2
"GO:0051208","GO:0051208","sequestering of calcium ion","2/4","128/18800",0.000273516367291148,0.002720768074633,0.000697050021905419,"CALR/HSP90B1",2
"GO:0010810","GO:0010810","regulation of cell-substrate adhesion","2/4","217/18800",0.000783658604302964,0.00718281224218815,0.00184020809323673,"CALR/P4HB",2
"GO:0051651","GO:0051651","maintenance of location in cell","2/4","219/18800",0.000798090249132017,0.00718281224218815,0.00184020809323673,"CALR/HSP90B1",2
"GO:0001666","GO:0001666","response to hypoxia","2/4","286/18800",0.00135607032764143,0.0116459755637093,0.00298365288738863,"HSP90B1/P4HB",2
"GO:0010720","GO:0010720","positive regulation of cell development","2/4","297/18800",0.00146142845723368,0.0116459755637093,0.00298365288738863,"CALR/P4HB",2
"GO:0036293","GO:0036293","response to decreased oxygen levels","2/4","299/18800",0.00148099868115173,0.0116459755637093,0.00298365288738863,"HSP90B1/P4HB",2
"GO:0022604","GO:0022604","regulation of cell morphogenesis","2/4","305/18800",0.00154047295816261,0.0116459755637093,0.00298365288738863,"CALR/P4HB",2
"GO:0070482","GO:0070482","response to oxygen levels","2/4","324/18800",0.00173634961121185,0.0126219260199631,0.00323368753505042,"HSP90B1/P4HB",2
"GO:0051235","GO:0051235","maintenance of location","2/4","331/18800",0.00181139741940629,0.012679781935844,0.0032485099919177,"CALR/HSP90B1",2
"GO:0018401","GO:0018401","peptidyl-proline hydroxylation to 4-hydroxy-L-proline","1/4","10/18800",0.00212613208600254,0.0129996349473825,0.00333045506866943,"P4HB",1
"GO:2000510","GO:2000510","positive regulation of dendritic cell chemotaxis","1/4","10/18800",0.00212613208600254,0.0129996349473825,0.00333045506866943,"CALR",1
"GO:0031589","GO:0031589","cell-substrate adhesion","2/4","364/18800",0.00218601059441179,0.0129996349473825,0.00333045506866943,"CALR/P4HB",2
"GO:2001233","GO:2001233","regulation of apoptotic signaling pathway","2/4","370/18800",0.00225779965055996,0.0129996349473825,0.00333045506866943,"P4HB/PDIA3",2
"GO:0046598","GO:0046598","positive regulation of viral entry into host cell","1/4","11/18800",0.0023385586677831,0.0129996349473825,0.00333045506866943,"P4HB",1
"GO:0075294","GO:0075294","positive regulation by symbiont of entry into host","1/4","11/18800",0.0023385586677831,0.0129996349473825,0.00333045506866943,"P4HB",1
"GO:2000508","GO:2000508","regulation of dendritic cell chemotaxis","1/4","11/18800",0.0023385586677831,0.0129996349473825,0.00333045506866943,"CALR",1
"GO:0071285","GO:0071285","cellular response to lithium ion","1/4","12/18800",0.00255095133185945,0.013775137192041,0.00352913567715894,"CALR",1
"GO:0042921","GO:0042921","glucocorticoid receptor signaling pathway","1/4","13/18800",0.00276331008184194,0.014397788870722,0.00368865657506663,"CALR",1
"GO:0043161","GO:0043161","proteasome-mediated ubiquitin-dependent protein catabolic process","2/4","414/18800",0.00281861475246939,0.014397788870722,0.00368865657506663,"CALR/HSP90B1",2
"GO:0031958","GO:0031958","corticosteroid receptor signaling pathway","1/4","14/18800",0.00297563492134123,0.0147998684245656,0.003791667766806,"CALR",1
"GO:0019511","GO:0019511","peptidyl-proline hydroxylation","1/4","15/18800",0.00318792585396743,0.0149879947605685,0.00383986499017629,"P4HB",1
"GO:0045785","GO:0045785","positive regulation of cell adhesion","2/4","446/18800",0.00326423340468126,0.0149879947605685,0.00383986499017629,"CALR/P4HB",2
"GO:0048385","GO:0048385","regulation of retinoic acid receptor signaling pathway","1/4","16/18800",0.00340018288333033,0.0149879947605685,0.00383986499017629,"CALR",1
"GO:1901163","GO:1901163","regulation of trophoblast cell migration","1/4","16/18800",0.00340018288333033,0.0149879947605685,0.00383986499017629,"CALR",1
"GO:0006874","GO:0006874","cellular calcium ion homeostasis","2/4","456/18800",0.00340996706192829,0.0149879947605685,0.00383986499017629,"CALR/HSP90B1",2
"GO:0055074","GO:0055074","calcium ion homeostasis","2/4","468/18800",0.00358890267084611,0.0151721052547681,0.00388703337075652,"CALR/HSP90B1",2
"GO:0061450","GO:0061450","trophoblast cell migration","1/4","17/18800",0.00361240601304003,0.0151721052547681,0.00388703337075652,"CALR",1
"GO:0071318","GO:0071318","cellular response to ATP","1/4","18/18800",0.00382459524670609,0.0157140978614663,0.00402588973337483,"HSP90B1",1
"GO:0072503","GO:0072503","cellular divalent inorganic cation homeostasis","2/4","494/18800",0.00399171785510921,0.0157664725152112,0.0040393079125576,"CALR/HSP90B1",2
"GO:0010498","GO:0010498","proteasomal protein catabolic process","2/4","496/18800",0.0040235581252724,0.0157664725152112,0.0040393079125576,"CALR/HSP90B1",2
"GO:0060284","GO:0060284","regulation of cell development","2/4","500/18800",0.00408760398542513,0.0157664725152112,0.0040393079125576,"CALR/P4HB",2
"GO:1903902","GO:1903902","positive regulation of viral life cycle","1/4","21/18800",0.00446095960753512,0.0168624273164828,0.00432008719887612,"P4HB",1
"GO:0010226","GO:0010226","response to lithium ion","1/4","22/18800",0.00467301329311798,0.0173176374980254,0.00443671024733595,"CALR",1
"GO:0002407","GO:0002407","dendritic cell chemotaxis","1/4","26/18800",0.00552088929154981,0.0200663091558253,0.00514090905690873,"CALR",1
"GO:0018126","GO:0018126","protein hydroxylation","1/4","27/18800",0.00573277362322289,0.0204432870714929,0.0052374893082076,"P4HB",1
"GO:0030970","GO:0030970","retrograde protein transport, ER to cytosol","1/4","29/18800",0.00615644071030252,0.020777987397271,0.00532323820815632,"HSP90B1",1
"GO:1902175","GO:1902175","regulation of oxidative stress-induced intrinsic apoptotic signaling pathway","1/4","29/18800",0.00615644071030252,0.020777987397271,0.00532323820815632,"P4HB",1
"GO:1903513","GO:1903513","endoplasmic reticulum to cytosol transport","1/4","29/18800",0.00615644071030252,0.020777987397271,0.00532323820815632,"HSP90B1",1
"GO:0033198","GO:0033198","response to ATP","1/4","30/18800",0.00636822347292354,0.0211156883575886,0.00540975585880855,"HSP90B1",1
"GO:0048384","GO:0048384","retinoic acid receptor signaling pathway","1/4","31/18800",0.00657997238640839,0.0214416341557101,0.00549326188338995,"CALR",1
"GO:0040020","GO:0040020","regulation of meiotic nuclear division","1/4","32/18800",0.00679168745436343,0.0217564225232998,0.00557390941838925,"CALR",1
"GO:0036336","GO:0036336","dendritic cell migration","1/4","33/18800",0.0070033686803963,0.0220606113432484,0.00565184139119702,"CALR",1
"GO:0033144","GO:0033144","negative regulation of intracellular steroid hormone receptor signaling pathway","1/4","37/18800",0.00784975523742903,0.0243213727848211,0.00623103953273055,"CALR",1
"GO:0030866","GO:0030866","cortical actin cytoskeleton organization","1/4","40/18800",0.00848418999171663,0.0258630952973297,0.00662602274395526,"CALR",1
"GO:0033574","GO:0033574","response to testosterone","1/4","41/18800",0.00869560061218766,0.026086801836563,0.00668333547469728,"CALR",1
"GO:0046596","GO:0046596","regulation of viral entry into host cell","1/4","43/18800",0.00911832042832217,0.0269275400148889,0.00689872927142796,"P4HB",1
"GO:0008631","GO:0008631","intrinsic apoptotic signaling pathway in response to oxidative stress","1/4","45/18800",0.00954090503541094,0.0277420161798872,0.00710739484419276,"P4HB",1
"GO:0032527","GO:0032527","protein exit from endoplasmic reticulum","1/4","48/18800",0.0101745284921587,0.029136149773,0.00746456635788359,"HSP90B1",1
"GO:0052372","GO:0052372","modulation by symbiont of entry into host","1/4","50/18800",0.0105967752027789,0.0294528016665473,0.00754569132086424,"P4HB",1
"GO:2001238","GO:2001238","positive regulation of extrinsic apoptotic signaling pathway","1/4","50/18800",0.0105967752027789,0.0294528016665473,0.00754569132086424,"PDIA3",1
"GO:0051445","GO:0051445","regulation of meiotic cell cycle","1/4","51/18800",0.0108078478907354,0.0296041050920144,0.0075844546601652,"CALR",1
"GO:0018208","GO:0018208","peptidyl-proline modification","1/4","56/18800",0.011862704801104,0.0315781860198401,0.00809020638770619,"P4HB",1
"GO:0043903","GO:0043903","regulation of biological process involved in symbiotic interaction","1/4","56/18800",0.011862704801104,0.0315781860198401,0.00809020638770619,"P4HB",1
"GO:0007566","GO:0007566","embryo implantation","1/4","57/18800",0.0120735749025125,0.0316931341190953,0.00811965563619261,"CALR",1
"GO:0006611","GO:0006611","protein export from nucleus","1/4","58/18800",0.0122844112521037,0.031804845570515,0.00814827566830236,"CALR",1
"GO:0043666","GO:0043666","regulation of phosphoprotein phosphatase activity","1/4","59/18800",0.0124952138534798,0.0319134515987526,0.00817610010327273,"HSP90B1",1
"GO:0030865","GO:0030865","cortical cytoskeleton organization","1/4","61/18800",0.0129167178259925,0.0321218377514813,0.00822948781157415,"CALR",1
"GO:0048524","GO:0048524","positive regulation of viral process","1/4","61/18800",0.0129167178259925,0.0321218377514813,0.00822948781157415,"P4HB",1
"GO:2000242","GO:2000242","negative regulation of reproductive process","1/4","63/18800",0.0133380868488604,0.0327389404472028,0.00838758708199013,"CALR",1
"GO:0071677","GO:0071677","positive regulation of mononuclear cell migration","1/4","66/18800",0.0139698874155931,0.0338501118147064,0.00867226479240599,"CALR",1
"GO:1901224","GO:1901224","positive regulation of NIK/NF-kappaB signaling","1/4","67/18800",0.0141804201608868,0.0339253089925014,0.00869153001200259,"CALR",1
"GO:0050766","GO:0050766","positive regulation of phagocytosis","1/4","71/18800",0.0150222140199775,0.035109235170741,0.00899484721723244,"CALR",1
"GO:0033143","GO:0033143","regulation of intracellular steroid hormone receptor signaling pathway","1/4","72/18800",0.0152325782222262,0.035109235170741,0.00899484721723244,"CALR",1
"GO:0045665","GO:0045665","negative regulation of neuron differentiation","1/4","72/18800",0.0152325782222262,0.035109235170741,0.00899484721723244,"CALR",1
"GO:1903201","GO:1903201","regulation of oxidative stress-induced cell death","1/4","77/18800",0.0162838938382781,0.0370801919931875,0.00949979856132901,"P4HB",1
"GO:0010921","GO:0010921","regulation of phosphatase activity","1/4","84/18800",0.0177543212490789,0.0399472228104276,0.0102343205195192,"HSP90B1",1
"GO:0035304","GO:0035304","regulation of protein dephosphorylation","1/4","91/18800",0.0192230995825976,0.0422160621471626,0.0108155881858506,"HSP90B1",1
"GO:0090398","GO:0090398","cellular senescence","1/4","91/18800",0.0192230995825976,0.0422160621471626,0.0108155881858506,"CALR",1
"GO:1900407","GO:1900407","regulation of cellular response to oxidative stress","1/4","92/18800",0.0194327905121859,0.0422160621471626,0.0108155881858506,"P4HB",1
"GO:0002690","GO:0002690","positive regulation of leukocyte chemotaxis","1/4","94/18800",0.0198520714973456,0.0426368353749808,0.0109233886229413,"CALR",1
"GO:0036473","GO:0036473","cell death in response to oxidative stress","1/4","98/18800",0.0206902300722506,0.0438893399620884,0.0112442753453415,"P4HB",1
"GO:0050764","GO:0050764","regulation of phagocytosis","1/4","99/18800",0.0208996856962326,0.0438893399620884,0.0112442753453415,"CALR",1
"GO:1902882","GO:1902882","regulation of response to oxidative stress","1/4","101/18800",0.0213184961456612,0.0442768766102194,0.0113435607021448,"P4HB",1
"GO:1901222","GO:1901222","regulation of NIK/NF-kappaB signaling","1/4","110/18800",0.0232014807037044,0.0476639114456537,0.0122113056335286,"CALR",1
"GO:0030518","GO:0030518","intracellular steroid hormone receptor signaling pathway","1/4","115/18800",0.0242464084266568,0.0491707493493315,0.0125973515459162,"CALR",1
"GO:0071675","GO:0071675","regulation of mononuclear cell migration","1/4","116/18800",0.0244552933271808,0.0491707493493315,0.0125973515459162,"CALR",1
